<?xml version="1.0"?>
<!DOCTYPE config SYSTEM "process_chp-config.dtd">

<config>
	<!-- defaults -->
	<jsonpath>htdocs/json</jsonpath>

	<!-- Sacramento -->
	<dispatch name="STCC-STCC">
		<geocode name="google" apikey="ABQIAAAAlAZP1OSueWm4o6pWOnsJahTWfCw_DNErtpfmuWl6JQkzmGW7WBT9Yucup9PJ4DO-lhEdGj3-tXkTwQ"/>
		<geocode name="yahoo" apikey=".7eSeNXV34FtD2sVFkwjUCKHS_PCGPyud.paQ5Az7xX3zBUFC6DoVsu5E3.1hPowluSe"/>

		<twitter login="sactraffic" password="snowcrash"/>
	</dispatch>

	<!-- Merced -->
	<dispatch name="FRCC-MRCC">
	</dispatch>

	<!-- Fresno -->
	<dispatch name="FRCC-FRCC">
	</dispatch>
</config>
